{
    "name": "Get-HotfixHistory",
    "description": "Lists Windows hotfixes and patches installed within a specified number of days.",
    "version": "1.0.0",
    "author": "SysOps Team",
    "category": "Compliance",
    "dangerLevel": "Safe",
    "outputFormat": "Table",
    "parameters": [
        {
            "name": "Days",
            "type": "int",
            "description": "Number of days to look back for installed hotfixes",
            "required": false,
            "defaultValue": "90"
        }
    ]
}
